{
  "$schema": "https://json-schema.org/draft/2020-12/schema",
  "$id": "https://raw.githubusercontent.com/joy7758/persona-object-protocol/main/schema/pop-persona.schema.json",
  "title": "POP Persona Object",
  "description": "Early preview schema for a framework-neutral persona object in POP. The persona core is defined separately from memory, tools, and permissions.",
  "type": "object",
  "additionalProperties": false,
  "properties": {
    "$schema": {
      "type": "string",
      "format": "uri",
      "description": "Optional self-declared schema identifier for the POP persona object."
    },
    "id": {
      "type": "string",
      "minLength": 1
    },
    "version": {
      "type": "string",
      "minLength": 1
    },
    "name": {
      "type": "string",
      "minLength": 1
    },
    "summary": {
      "type": "string",
      "minLength": 1
    },
    "traits": {
      "type": "array",
      "items": {
        "type": "string",
        "minLength": 1
      }
    },
    "communication_style": {
      "type": "array",
      "items": {
        "type": "string",
        "minLength": 1
      }
    },
    "task_orientation": {
      "type": "array",
      "items": {
        "type": "string",
        "minLength": 1
      }
    },
    "boundaries": {
      "type": "array",
      "items": {
        "type": "string",
        "minLength": 1
      }
    },
    "preferred_outputs": {
      "type": "array",
      "items": {
        "type": "string",
        "minLength": 1
      }
    },
    "metadata": {
      "type": "object",
      "additionalProperties": true
    }
  },
  "required": [
    "id",
    "version",
    "name",
    "summary",
    "traits",
    "communication_style",
    "task_orientation",
    "boundaries",
    "preferred_outputs",
    "metadata"
  ]
}
